{
  "$schema": "https://json-schema.org/draft/2020-12/schema",
  "title": "PromptPack",
  "type": "object",
  "additionalProperties": false,
  "required": ["name", "source_skill", "description", "prompts", "metadata"],
  "properties": {
    "name": { "type": "string", "minLength": 1 },
    "source_skill": { "type": "string", "minLength": 1 },
    "description": { "type": "string", "minLength": 1 },
    "prompts": {
      "type": "array",
      "items": {
        "type": "object",
        "additionalProperties": false,
        "required": ["name", "template"],
        "properties": {
          "name": { "type": "string", "minLength": 1 },
          "template": { "type": "string", "minLength": 1 },
          "use_case": { "type": "string" }
        }
      }
    },
    "metadata": {
      "type": "object",
      "additionalProperties": false,
      "required": ["repo_url", "generated_from"],
      "properties": {
        "repo_url": { "type": "string", "format": "uri" },
        "generated_from": { "type": "string", "minLength": 1 }
      }
    }
  }
}