{
  "name": "alwrity_prompts",
  "source_skill": "alwrity",
  "description": "Reusable prompt pack derived from the alwrity capability.",
  "prompts": [
    {
      "name": "content_strategy_generation",
      "template": "Create a digital marketing content strategy targeting {marketing_goals} with focus on {content_brief}.",
      "use_case": "Developing an AI-based content marketing plan for new product launches."
    },
    {
      "name": "multimodal_content_creation",
      "template": "Generate {content_type} content based on the strategy: {content_strategy_plan}.",
      "use_case": "Automating creation and publishing of diverse marketing materials."
    },
    {
      "name": "seo_optimization_prompt",
      "template": "Analyze the content for SEO opportunities focusing on these keywords: {seo_keywords}.",
      "use_case": "Optimizing existing content for better search engine rankings using AI insights."
    },
    {
      "name": "analytics_insight_request",
      "template": "Provide performance insights and recommendations for the campaign data: {performance_metrics}.",
      "use_case": "Managing multiple social media accounts and scheduling posts from one platform."
    },
    {
      "name": "social_media_publish_schedule",
      "template": "Schedule publishing of content titled '{content_title}' across connected social media accounts on {publish_date}.",
      "use_case": "Tracking campaign performance and making data-driven marketing decisions."
    }
  ],
  "metadata": {
    "repo_url": "https://github.com/ALwrity/ALwrity",
    "generated_from": "alwrity"
  }
}