{
  "name": "yao_open_prompts_prompts",
  "source_skill": "yao_open_prompts",
  "description": "Reusable prompt pack derived from the yao_open_prompts capability.",
  "prompts": [
    {
      "name": "yao_open_prompts_default_prompt",
      "template": "A practical bilingual library providing AI prompt templates for prompt engineering to support work, learning, content creation, marketing, and everyday applications.",
      "use_case": "Creating customized AI prompts for bilingual content marketing campaigns."
    }
  ],
  "metadata": {
    "repo_url": "https://github.com/yaojingang/yao-open-prompts",
    "generated_from": "yao_open_prompts"
  }
}