{
  "name": "claude_skills_prompts",
  "source_skill": "claude_skills",
  "description": "Reusable prompt pack derived from the claude_skills capability.",
  "prompts": [
    {
      "name": "skill_invocation",
      "template": "Execute the skill for {task_description} using agent {agent_name} with input: {agent_input}",
      "use_case": "Automating coding tasks across multiple AI coding agents"
    },
    {
      "name": "custom_command_execution",
      "template": "Run the custom command '{custom_command}' with parameters {parameters} on agent {agent_name}",
      "use_case": "Building custom agent workflows for engineering and product management"
    },
    {
      "name": "reference_based_query",
      "template": "Using reference data {reference_name}, respond to: {query}",
      "use_case": "Enhancing compliance and finance advisory processes using AI"
    }
  ],
  "metadata": {
    "repo_url": "https://github.com/alirezarezvani/claude-skills",
    "generated_from": "claude_skills"
  }
}