{
  "name": "ai_marketing_skills_prompts",
  "source_skill": "ai_marketing_skills",
  "description": "Reusable prompt pack derived from the ai_marketing_skills capability.",
  "prompts": [
    {
      "name": "growth_experiment_setup",
      "template": "Design a growth experiment for {campaign_name} targeting {audience} with goals {goals_list}.",
      "use_case": "Running growth experiments to validate marketing hypotheses and improve ROI"
    },
    {
      "name": "seo_optimization_prompt",
      "template": "Suggest SEO improvements for the content related to {topic} focusing on keywords {keywords}.",
      "use_case": "Automating sales pipeline management to increase efficiency and track leads"
    },
    {
      "name": "outbound_message_generator",
      "template": "Create a personalized outbound email message for {contact_name} from {company_name} about {product_or_service}.",
      "use_case": "Generating SEO-friendly content to boost organic traffic"
    },
    {
      "name": "sales_pipeline_update",
      "template": "Update the sales pipeline status for lead {lead_name} with current stage {stage} and next steps {next_steps}.",
      "use_case": "Executing outbound marketing campaigns with personalized AI-driven messaging"
    },
    {
      "name": "finance_automation_task",
      "template": "Automate the marketing finance process for budget {budget_amount} and track ROI from campaigns {campaign_list}.",
      "use_case": "Automating finance-related marketing processes including budget tracking and ROI analysis"
    }
  ],
  "metadata": {
    "repo_url": "https://github.com/ericosiu/ai-marketing-skills",
    "generated_from": "ai_marketing_skills"
  }
}