{
  "name": "seo_geo_claude_skills_prompts",
  "source_skill": "seo_geo_claude_skills",
  "description": "Reusable prompt pack derived from the seo_geo_claude_skills capability.",
  "prompts": [
    {
      "name": "seo_geo_claude_skills_default_prompt",
      "template": "20 SEO & GEO skills for Claude Code, Cursor, Codex, and 35+ AI agents. Keyword research, content writing, technical audits, rank tracking. CORE-EEAT + CITE frameworks.",
      "use_case": "marketing automation"
    }
  ],
  "metadata": {
    "repo_url": "https://github.com/aaron-he-zhu/seo-geo-claude-skills",
    "generated_from": "seo_geo_claude_skills"
  }
}