{
  "name": "ai_marketing_claude_prompts",
  "source_skill": "ai_marketing_claude",
  "description": "Reusable prompt pack derived from the ai_marketing_claude capability.",
  "prompts": [
    {
      "name": "ai_marketing_claude_default_prompt",
      "template": "AI Marketing Suite for Claude Code. 15 marketing skills with parallel subagents — audit any website, generate copy, email sequences, ad campaigns, content calendars, competitive intelligence, and client-ready PDF reports.",
      "use_case": "marketing automation"
    }
  ],
  "metadata": {
    "repo_url": "https://github.com/zubair-trabzada/ai-marketing-claude",
    "generated_from": "ai_marketing_claude"
  }
}