{
  "name": "openoutreach_prompts",
  "source_skill": "openoutreach",
  "description": "Reusable prompt pack derived from the openoutreach capability.",
  "prompts": [
    {
      "name": "lead_identification_prompt",
      "template": "Describe your product: {product_description}. Find leads that fit this description.",
      "use_case": "Startups seeking targeted B2B leads for new product launches."
    },
    {
      "name": "lead_explanation_prompt",
      "template": "Explain why this person is a good fit: {lead_profile} for the product described as {product_description}.",
      "use_case": "Sales teams automating personalized outreach at scale."
    },
    {
      "name": "email_generation_prompt",
      "template": "Generate a personalized outreach email for lead {lead_name} based on the following template: {email_template}.",
      "use_case": "Marketing departments improving lead quality with AI insights."
    }
  ],
  "metadata": {
    "repo_url": "https://github.com/eracle/OpenOutreach",
    "generated_from": "openoutreach"
  }
}