{
  "name": "marketingskills_prompts",
  "source_skill": "marketingskills",
  "description": "Reusable prompt pack derived from the marketingskills capability.",
  "prompts": [
    {
      "name": "generate_marketing_copy",
      "template": "Generate a persuasive marketing copy targeting {target_audience} aimed at achieving {marketing_goal} with tone and style {content_parameters}.",
      "use_case": "Enhancing website conversion rates through AI-generated CRO tactics"
    },
    {
      "name": "seo_strategy_suggestion",
      "template": "Provide SEO recommendations to improve ranking for keywords related to {marketing_goal} targeting {target_audience}.",
      "use_case": "Creating SEO-optimized content for improved organic search performance"
    },
    {
      "name": "growth_analysis_report",
      "template": "Analyze the following analytics data and create a growth report with actionable insights: {analytics_data}.",
      "use_case": "Generating compelling marketing copy tailored to specific demographics"
    },
    {
      "name": "conversion_rate_optimization_plan",
      "template": "Develop a conversion rate optimization strategy based on current data and focus on the goal: {marketing_goal}.",
      "use_case": "Performing growth engineering analysis to identify scalable opportunities"
    }
  ],
  "metadata": {
    "repo_url": "https://github.com/coreyhaines31/marketingskills",
    "generated_from": "marketingskills"
  }
}