{
  "name": "ai_content_studio_prompts",
  "source_skill": "ai_content_studio",
  "description": "Reusable prompt pack derived from the ai_content_studio capability.",
  "prompts": [
    {
      "name": "script_generation_prompt",
      "template": "Write a detailed script about the topic: {topic} with style {style} and length {length}.",
      "use_case": "YouTube content creators automating video production"
    },
    {
      "name": "voiceover_generation_prompt",
      "template": "Generate a natural voiceover for the script: {script} using voice type {voice_type} in language {language}.",
      "use_case": "Marketing teams generating video ads or promos rapidly"
    },
    {
      "name": "video_creation_prompt",
      "template": "Create a video by combining the voiceover audio: {voiceover_audio} with visual assets according to theme {theme}.",
      "use_case": "Educational content automation for video lessons"
    },
    {
      "name": "upload_video_prompt",
      "template": "Upload the video file {video_file} to YouTube with title '{title}', description '{description}', and tags {tags}.",
      "use_case": "Small businesses producing frequent video updates without manual editing"
    }
  ],
  "metadata": {
    "repo_url": "https://github.com/naqashafzal/AI-Content-Studio",
    "generated_from": "ai_content_studio"
  }
}